{
  "schemaVersion": 1,
  "version": "1.0.0",
  "applicability": {
    "properties": [
      "public-facing",
      "html-ui",
      "seo-relevant",
      "payment-api",
      "personal-data",
      "authenticated",
      "persistent-data",
      "realtime",
      "localized",
      "deployable"
    ],
    "missing": "unknown",
    "inheritance": "none",
    "mode": "documentation-only"
  },
  "sources": [
    {
      "id": "google-review",
      "title": {
        "en": "Google code review guidance",
        "de": "Google-Leitfaden für Code-Reviews"
      },
      "url": "https://google.github.io/eng-practices/review/reviewer/looking-for.html"
    },
    {
      "id": "angular-style",
      "title": {
        "en": "Angular style guide",
        "de": "Angular-Stilleitfaden"
      },
      "url": "https://angular.dev/style-guide"
    },
    {
      "id": "dotnet-architecture",
      "title": {
        "en": "Microsoft application architecture",
        "de": "Microsoft-Anwendungsarchitektur"
      },
      "url": "https://learn.microsoft.com/en-us/dotnet/architecture/modern-web-apps-azure/common-web-application-architectures"
    },
    {
      "id": "owasp-asvs",
      "title": {
        "en": "OWASP Application Security Verification Standard",
        "de": "OWASP-Standard zur Prüfung der Anwendungssicherheit"
      },
      "url": "https://owasp.org/www-project-application-security-verification-standard/"
    },
    {
      "id": "w3c-privacy",
      "title": {
        "en": "W3C Privacy Principles",
        "de": "W3C-Datenschutzprinzipien"
      },
      "url": "https://www.w3.org/TR/privacy-principles/"
    },
    {
      "id": "stripe-idempotency",
      "title": {
        "en": "Stripe idempotent requests",
        "de": "Idempotente Anfragen bei Stripe"
      },
      "url": "https://docs.stripe.com/api/idempotent_requests"
    },
    {
      "id": "google-sre",
      "title": {
        "en": "Google SRE: monitoring distributed systems",
        "de": "Google SRE: Verteilte Systeme überwachen"
      },
      "url": "https://sre.google/sre-book/monitoring-distributed-systems/"
    },
    {
      "id": "web-vitals",
      "title": {
        "en": "Google Web Vitals",
        "de": "Google Web Vitals"
      },
      "url": "https://web.dev/articles/vitals"
    },
    {
      "id": "wcag",
      "title": {
        "en": "W3C WCAG 2.2 quick reference",
        "de": "W3C-Kurzreferenz zu WCAG 2.2"
      },
      "url": "https://www.w3.org/WAI/WCAG22/quickref/"
    },
    {
      "id": "google-seo",
      "title": {
        "en": "Google Search Central SEO starter guide",
        "de": "SEO-Einstiegsleitfaden von Google Search Central"
      },
      "url": "https://developers.google.com/search/docs/fundamentals/seo-starter-guide"
    },
    {
      "id": "w3c-i18n",
      "title": {
        "en": "W3C internationalization quick tips",
        "de": "W3C-Kurztipps zur Internationalisierung"
      },
      "url": "https://www.w3.org/International/quicktips/"
    },
    {
      "id": "kubernetes-probes",
      "title": {
        "en": "Kubernetes liveness, readiness and startup probes",
        "de": "Kubernetes-Prüfungen für Lebensfähigkeit, Bereitschaft und Start"
      },
      "url": "https://kubernetes.io/docs/concepts/workloads/pods/probes/"
    },
    {
      "id": "web-vitals-thresholds",
      "title": {
        "en": "Google: defining Core Web Vitals thresholds",
        "de": "Google: Schwellenwerte für Core Web Vitals"
      },
      "url": "https://web.dev/articles/defining-core-web-vitals-thresholds"
    },
    {
      "id": "stripe-webhooks",
      "title": {
        "en": "Stripe webhook event handling",
        "de": "Verarbeitung von Stripe-Webhook-Ereignissen"
      },
      "url": "https://docs.stripe.com/webhooks"
    }
  ],
  "domains": [
    {
      "id": "architecture",
      "title": {
        "en": "Architecture",
        "de": "Architektur"
      },
      "why": {
        "en": "Clear ownership makes change impact easier to understand.",
        "de": "Klare Zuständigkeiten machen Änderungsfolgen verständlicher."
      },
      "evidence": {
        "en": "Repository architecture contract, source layout and dependency direction.",
        "de": "Architekturvertrag des Repositorys, Quellcodeaufbau und Abhängigkeitsrichtung."
      },
      "limits": {
        "en": "Directory checks do not establish component cohesion.",
        "de": "Verzeichnisprüfungen belegen keinen inhaltlichen Zusammenhalt von Komponenten."
      },
      "checks": [
        {
          "id": "architecture-boundaries",
          "title": {
            "en": "Declared boundaries and ownership",
            "de": "Festgelegte Grenzen und Zuständigkeiten"
          },
          "status": "review-rule",
          "method": "review",
          "ruleIds": [
            "QS-GN-003",
            "QS-NG-003",
            "QS-CS-002"
          ],
          "metricIds": [],
          "rationale": {
            "en": "Changes should fit the declared architecture.",
            "de": "Änderungen sollen zur festgelegten Architektur passen."
          },
          "evidence": {
            "en": "Read the contract beside changed paths, imports and service registrations.",
            "de": "Vertrag gemeinsam mit geänderten Pfaden, Imports und Dienstregistrierungen lesen."
          },
          "interpretation": {
            "en": "Existing rules support concrete contract and dependency findings.",
            "de": "Vorhandene Regeln unterstützen konkrete Findings zu Verträgen und Abhängigkeiten."
          },
          "limits": {
            "en": "A different documented layout is not itself a defect. No architecture score is calculated.",
            "de": "Ein abweichender dokumentierter Aufbau ist allein kein Fehler. Es wird kein Architekturpunktwert berechnet."
          },
          "sourceIds": [
            "angular-style",
            "dotnet-architecture"
          ],
          "applicability": {
            "subjectScope": "project",
            "allOf": [],
            "anyOf": [],
            "noneOf": []
          }
        }
      ]
    },
    {
      "id": "correctness",
      "title": {
        "en": "Correctness",
        "de": "Korrektheit"
      },
      "why": {
        "en": "A review should explain observable failures.",
        "de": "Ein Review soll beobachtbare Fehler erklären."
      },
      "evidence": {
        "en": "Triggers, state transitions, source locations and reproduced behavior.",
        "de": "Auslöser, Zustandsübergänge, Fundstellen und reproduziertes Verhalten."
      },
      "limits": {
        "en": "A review grade is judgment, not proof of correctness.",
        "de": "Eine Review-Bewertung ist ein Urteil, kein Korrektheitsbeweis."
      },
      "checks": [
        {
          "id": "correctness-behavior",
          "title": {
            "en": "Behavior and concurrent state changes",
            "de": "Verhalten und gleichzeitige Zustandsänderungen"
          },
          "status": "review-rule",
          "method": "review",
          "ruleIds": [
            "QS-GN-004",
            "QS-CS-003"
          ],
          "metricIds": [],
          "rationale": {
            "en": "Failures need a plausible trigger and a concrete consequence.",
            "de": "Fehler benötigen einen plausiblen Auslöser und eine konkrete Folge."
          },
          "evidence": {
            "en": "Trace callers, cancellation, stale responses and relevant regression cases.",
            "de": "Aufrufer, Abbruch, veraltete Antworten und passende Regressionsfälle nachvollziehen."
          },
          "interpretation": {
            "en": "The linked rules guide source-grounded findings.",
            "de": "Die verlinkten Regeln leiten zu quellcodegestützten Findings an."
          },
          "limits": {
            "en": "Unverified assumptions remain uncertainty; no automatic correctness verdict is produced.",
            "de": "Ungeprüfte Annahmen bleiben unsicher; es entsteht kein automatisches Korrektheitsurteil."
          },
          "sourceIds": [
            "google-review"
          ],
          "applicability": {
            "subjectScope": "component",
            "allOf": [],
            "anyOf": [],
            "noneOf": []
          }
        },
        {
          "id": "correctness-grade",
          "title": {
            "en": "Recorded and effective review grade",
            "de": "Gespeicherte und effektive Review-Bewertung"
          },
          "status": "implemented-metric",
          "method": "review",
          "ruleIds": [],
          "metricIds": [
            "grade"
          ],
          "rationale": {
            "en": "The displayed grade needs its review and triage context.",
            "de": "Die angezeigte Bewertung benötigt ihren Review- und Einstufungskontext."
          },
          "evidence": {
            "en": "Stored review score, finding states and security verdict.",
            "de": "Gespeicherter Review-Punktwert, Finding-Zustände und Sicherheitsurteil."
          },
          "interpretation": {
            "en": "Use the existing grade definition for weights, caps and rounding.",
            "de": "Die bestehende Bewertungsdefinition beschreibt Gewichte, Obergrenzen und Rundung."
          },
          "limits": {
            "en": "Triage can change this value without a code change. It is not a measured probability.",
            "de": "Die Einstufung kann den Wert ohne Codeänderung verändern. Er ist keine gemessene Wahrscheinlichkeit."
          },
          "sourceIds": [
            "google-review"
          ],
          "applicability": {
            "subjectScope": "project",
            "allOf": [],
            "anyOf": [],
            "noneOf": []
          }
        }
      ]
    },
    {
      "id": "testing",
      "title": {
        "en": "Testing",
        "de": "Tests"
      },
      "why": {